<?xml version="1.0" encoding="UTF-8"?>
<!DOCTYPE config SYSTEM "http://www.matsim.org/files/dtd/config_v2.dtd">
<config>
    <module name="zeroEmissionZone">
        <param name="enabled" value="true" />
        <param name="zoneLinkIds" value="" />
        <param name="allowedVehicleTypes" value="" />
        <param name="policyConfiguration" value="" />
        <param name="operatingStartTime" value="07:00" />
        <param name="operatingEndTime" value="19:00" />
        <param name="lengthRestrictions" value="" />
    </module>

    <module name="network">
        <param name="inputNetworkFile" value="matsim-input/network.xml" />
    </module>

    <module name="plans">
        <param name="inputPlansFile" value="matsim-input/population.xml" />
    </module>

    <module name="transit">
        <param name="useTransit" value="true" />
        <param name="transitScheduleFile" value="matsim-input/pt/transitSchedule.xml" />
        <param name="vehiclesFile" value="matsim-input/pt/transitVehicles.xml" />
    </module>

    <module name="controler">
        <param name="outputDirectory" value="output/zero-emission-test" />
        <param name="firstIteration" value="0" />
        <param name="lastIteration" value="10" />
        <param name="writeEventsInterval" value="1" />
        <param name="writePlansInterval" value="1" />
        <param name="mobsim" value="qsim" />
    </module>

    <module name="qsim">
        <param name="startTime" value="00:00:00" />
        <param name="endTime" value="24:00:00" />
        <param name="flowCapacityFactor" value="1.0" />
        <param name="storageCapacityFactor" value="1.0" />
        <param name="numberOfThreads" value="1" />
        <param name="mainModes" value="car,pt" />
        <param name="vehicleBehavior" value="wait" />
        <param name="vehiclesSource" value="modeVehicleTypesFromVehiclesData" />
        <param name="useTransit" value="true" />
    </module>

    <module name="planCalcScore">
        <param name="learningRate" value="1.0" />
        <param name="BrainExpBeta" value="2.0" />
        <parameterset type="scoringParameters">
            <param name="lateArrival" value="-18" />
            <param name="earlyDeparture" value="-0" />
            <param name="performing" value="+6" />
            <param name="waiting" value="-0" />

            <parameterset type="modeParams">
                <param name="mode" value="car" />
                <param name="marginalUtilityOfTraveling_util_hr" value="-6.0" />
            </parameterset>

            <parameterset type="modeParams">
                <param name="mode" value="pt" />
                <param name="marginalUtilityOfTraveling_util_hr" value="-6.0" />
                <param name="constantValue" value="-1.0" />
            </parameterset>

            <parameterset type="modeParams">
                <param name="mode" value="walk" />
                <param name="marginalUtilityOfTraveling_util_hr" value="-12.0" />
                <param name="constantValue" value="-3.0" />
            </parameterset>

            <parameterset type="modeParams">
                <param name="mode" value="transit_walk" />
                <param name="marginalUtilityOfTraveling_util_hr" value="-12.0" />
                <param name="constantValue" value="-3.0" />
            </parameterset>
        </parameterset>
    </module>

    <module name="transitRouter">
        <param name="maxBeelineWalkConnectionDistance" value="1000.0" />
        <param name="searchRadius" value="1000.0" />
        <param name="extensionRadius" value="500.0" />
    </module>

    <module name="strategy">
        <param name="maxAgentPlanMemorySize" value="5" />
        <parameterset type="strategysettings">
            <param name="strategyName" value="ChangeExpBeta" />
            <param name="weight" value="0.7" />
        </parameterset>
        <parameterset type="strategysettings">
            <param name="strategyName" value="ReRoute" />
            <param name="weight" value="0.2" />
        </parameterset>
        <parameterset type="strategysettings">
            <param name="strategyName" value="ChangeTripMode" />
            <param name="weight" value="0.1" />
        </parameterset>
    </module>
</config>
