<?xml version="1.0" encoding="UTF-8"?>
<!DOCTYPE config SYSTEM "dtd/config_v2.dtd">
<config>
    <module name="network">
        <param name="inputNetworkFile" value="network.xml" />
    </module>

    <module name="plans">
        <param name="inputPlansFile" value="population.xml" />
    </module>

    <module name="controller">
        <param name="outputDirectory" value="output" />
        <param name="firstIteration" value="0" />
        <param name="lastIteration" value="1" />
        <param name="mobsim" value="qsim" />
        <param name="routingAlgorithmType" value="FastAStarLandmarks" />
    </module>

    <module name="qsim">
        <param name="startTime" value="00:00:00" />
        <param name="endTime" value="24:00:00" />
        <param name="numberOfThreads" value="1" />
        <param name="flowCapacityFactor" value="1.0" />
        <param name="storageCapacityFactor" value="1.0" />
        <param name="stuckTime" value="10.0" />
        <param name="removeStuckVehicles" value="true" />
        <param name="insertingWaitingVehiclesBeforeDrivingVehicles" value="true" />
    </module>

    <module name="scoring">
        <param name="learningRate" value="1.0" />
        <param name="BrainExpBeta" value="2.0" />
        <param name="marginalUtilityOfMoney" value="1.0" />
        
        <parameterset type="scoringParameters">
            <param name="lateArrival" value="-18.0" />
            <param name="earlyDeparture" value="-0.0" />
            <param name="performing" value="6.0" />
            <param name="waiting" value="-0.0" />

            <parameterset type="modeParams">
                <param name="mode" value="car" />
                <param name="marginalUtilityOfTraveling_util_hr" value="-6.0" />
                <param name="monetaryDistanceRate" value="-0.0002" />
            </parameterset>
            <parameterset type="modeParams">
                <param name="mode" value="pt" />
                <param name="marginalUtilityOfTraveling_util_hr" value="-6.0" />
                <param name="monetaryDistanceRate" value="-0.0001" />
            </parameterset>
            <parameterset type="modeParams">
                <param name="mode" value="walk" />
                <param name="marginalUtilityOfTraveling_util_hr" value="-6.0" />
            </parameterset>
            <parameterset type="modeParams">
                <param name="mode" value="bike" />
                <param name="marginalUtilityOfTraveling_util_hr" value="-6.0" />
            </parameterset>
            <parameterset type="modeParams">
                <param name="mode" value="ride" />
                <param name="marginalUtilityOfTraveling_util_hr" value="-6.0" />
                <param name="monetaryDistanceRate" value="-0.0002" />
            </parameterset>

            <parameterset type="activityParams">
                <param name="activityType" value="home" />
                <param name="typicalDuration" value="12:00:00" />
            </parameterset>
            <parameterset type="activityParams">
                <param name="activityType" value="work" />
                <param name="typicalDuration" value="08:00:00" />
            </parameterset>
            <parameterset type="activityParams">
                <param name="activityType" value="shop" />
                <param name="typicalDuration" value="01:00:00" />
            </parameterset>
            <parameterset type="activityParams">
                <param name="activityType" value="leisure" />
                <param name="typicalDuration" value="02:00:00" />
            </parameterset>
        </parameterset>
    </module>

    <module name="replanning">
        <param name="maxAgentPlanMemorySize" value="5" />
        <param name="planSelectorForRemoval" value="WorstPlanSelector" />

        <parameterset type="strategysettings">
            <param name="strategyName" value="ChangeExpBeta" />
            <param name="weight" value="0.8" />
        </parameterset>
        <parameterset type="strategysettings">
            <param name="strategyName" value="ReRoute" />
            <param name="weight" value="0.2" />
        </parameterset>
        <parameterset type="strategysettings">
            <param name="strategyName" value="TimeAllocationMutator" />
            <param name="weight" value="0.1" />
        </parameterset>
    </module>

    <module name="TimeAllocationMutator">
        <param name="mutationRange" value="7200" />
    </module>

    <module name="global">
        <param name="coordinateSystem" value="EPSG:32188" />
        <param name="numberOfThreads" value="1" />
    </module>
</config>
